company_name,website,logo_url,description,info_2,info_3,product_categories_
2G Energy AG,http://2-g.com/en,assets/images/exhibitor-directory/1759131741_logo-2g-energy-500x5001759131820_1759131741_logo-2g-energy-500x500.jpg,"2G Energy AG is currently one of the leading international manufacturers of combined heat and power systems for the decentralized production of energy (20 to 4,500 kW).Founded in Heek (North Rhine-Westphalia, Germany) in 1995. As a technological leader with 14 subsidiaries and over 1000 employees worldwide, we provide holistic energy supply solutions suited to almost any field of application imaginable, including the agricultural sector, municipalities, the housing industry, commercial enterprises, medium-scale and major industrial enterprises, the energy sector and many more.",Germany,2-g.com/en,"ENERGY EFFICIENCY > Energy efficient equipments for power generation, transmission and distribution , Cogeneration > Complete plant solution providers , Cogeneration > Project developers , Cogeneration > Equipment suppliers and service providers"
A.EBERLE SYSTEMS PVT LTD,http://www.a-eberle.de/en/,assets/images/exhibitor-directory/dummy.png,"A. Eberle GmbH & Co. KG is German company. Excelling in manufacturing products for Generation, Transmission & Distribution. 
PQSYS / PQM is Power Quality monitoring system which gets integrated with PPC and SCADA system.
Data logger / DR is high resolution Disturbance Recorder primarily used for recording faults on inverter side with larger memory slot. 
REGSYS is advanced Transformer monitoring and Voltage Regulator system.",India,www.a-eberle.de/en/,"Solar Energy > Inverters, charge controllers, batteries and module connectors , Solar Energy > Software solutions and providers of irradiation data , Solar Energy > Electrical test and measuring systems , Wind Energy > Electrical and electronics items manufacturers , ENERGY EFFICIENCY > Energy efficient equipments for power generation, transmission and distribution , Cogeneration > Automation measuring and control systems"
Aatmanirbhar Solar Pvt. Ltd,http://www.aatmanirbharsolar.com/,assets/images/exhibitor-directory/dummy.png,"Aatmanirbhar Solar Pvt. Ltd. is an emerging young solar manufacturing unit at kapadvanj (Gujarat) - India, Manufacturing High efficiency Solar PV Modules with the high-tech fully automated manufacturing plant of 300 MW per annum capacity.

Our products can be used across India as Ground Mounted and Roof Top. is is also serving to the agriculture industries as a Pumping Solution by using ASPL solar panels.

Our aim is to contribute to India's Green Energy as well as Climate Goals which brings affordable & accessible solutions for the nation",India,www.aatmanirbharsolar.com/,"Solar Energy > Photovoltaic (PV) modules, hybrid systems, materials and equipments"
AB INDUSTRIES(NEOCAB-PV),http://www.neocabpv.com,assets/images/exhibitor-directory/dummy.png,"Neocab-PV is a leading manufacturer of PV Ribbon Interconnects, Busbar,Wires, Cables, and Aluminium & Copper Conductors, serving the solar and electrical industry with excellence for over two decades. With more than 20 years of proven expertise, we have established ourselves as one of the largest and most trusted manufacturers in the sector. Our state-of-the-art manufacturing facilities, stringent quality control, and continuous innovation enable us to deliver products that meet international standards and support the growing demand for renewable energy solutions. At Neocab-PV, we are committed to powering the future of clean energy by providing high-performance, reliable, and sustainable",India,www.neocabpv.com,"Solar Energy > Solar cells manufacturers , Solar Energy > Suppliers of raw materials , Wind Energy > Electrical and electronics items manufacturers , other, Manufacturer of Solar PV Ribbon Interconnect,Busbar, Wires and Cables"
ABHYUDAY POWER COMPONENETS LLP,http://WWW.APCLINDIA.CO.IN,assets/images/exhibitor-directory/dummy.png,"Abhyuday Power Components (APCL) carries the legacy of the Vardhaman Stampings Pvt Ltd & Group Companies, with half a century of experience & expertise in delivering world class CRGO Transformer Cores for Power & Distribution Transformers, Wound Core for Single & Three Phase Transformers, Toroidal Cores for CT’s & PT’s, Tank Shunt, Yoke Shunt & Radiators for Power & Distribution Transformers to its clients in India and across the world in 45 countries. Backed by this strong market prowess, APCL has poised itself as a premier manufacturer of high-tech & high-quality transformers up to 15 MVA, 66 kV class",India,WWW.APCLINDIA.CO.IN,"Wind Energy > Electrical and electronics items manufacturers , ENERGY EFFICIENCY > Energy efficient equipments for power generation, transmission and distribution"
Acelion Energy Storage Solutions Pvt Ltd,http://www.acelionenergy.com,assets/images/exhibitor-directory/1760618677_acelionlogo1760618790_1760618677_acelionlogo.jpeg,"Acelion — Powering the Future with Intelligent Energy Ecosystems Founded in 1986, Acelion has evolved from an EPC pioneer into a next-generation clean-tech company redefining India’s energy landscape. With 39 years of engineering excellence, we design and manufacture intelligent energy solutions that unite inverters, batteries, BMS, and smart connectivity into one seamless ecosystem. At the heart of Acelion lies innovation — from Silicon Carbide (SiC) technology delivering up to 98% efficiency, to Mesh Topology and Matter-enabled smart integration. Acelion is not just powering systems — we’re empowering people.",India,www.acelionenergy.com,"other, Manufacturing Hybrid Inverter & Batteries"
Adani Solar,http://www.adanisolar.com,assets/images/exhibitor-directory/1758881651_screenshot2025-09-26at3.43.55pm1758881659_1758881651_screenshot2025-09-26at3.43.55pm.png,"Adani Solar is one of India’s leading Tier-1 solar panel manufacturers, known for delivering high-efficiency and reliable solar solutions. We are building the world’s first fully integrated and comprehensive 10 GW solar manufacturing ecosystem, covering the entire value chain from polysilicon to modules, and we stand at the forefront of innovation, quality, and scale in renewable energy space. We have an operational capacity of 4GW for cells and modules and proudly operate India’s only ingot + Wafer facility of 2GW. Our module capacity is expected to scale to 10 GW by next financial year 2026.",India,www.adanisolar.com,"Solar Energy > Manufacturers of cell and module encapsulation, crystal growth equipments, diffusion furnaces, laminators, mounting systems, concentrators, trackers and collectors , Solar Energy > Silicon feedstock, ingot and wafer manufacturing , Solar Energy > Photovoltaic (PV) modules, hybrid systems, materials and equipments , Solar Energy > Solar cells manufacturers"
Adaptive Engineering Pvt. Ltd.,http://www.adaptive-engg.com,assets/images/exhibitor-directory/1758978405_adaptivelogo-new-transparent1758978776_1758978405_adaptivelogo-new-transparent.png,"AEPL is a trusted leader in renewable energy automation, delivering end-to-end solutions from design to commissioning and maintenance. Our expertise spans Plant SCADA, Power Plant Controllers (PPC), Substation Automation (SAS), Central Monitoring Systems, IoT-SCADA, EMS-BESS, and advanced LT/HT/ACDB Panels. With 51 GW+ SCADA and 49 GW+ PPC solutions already delivered, AEPL stands as the most experienced Solar SCADA partner in the industry. Backed by unmatched technical expertise and innovative approaches, we ensure seamless project execution, peak performance, and long-term reliability. At AEPL, we don’t just power projects—we empower industries to achieve sustainable growth with smart energy solutions.",India,www.adaptive-engg.com,"Solar Energy > Software solutions and providers of irradiation data , Solar Energy > Turnkey solution providers , Solar Energy > Annual maintenance contractors , Wind Energy > Wind monitoring and analysis systems suppliers , Wind Energy > Wind-Solar hybrid power system integrators , Cogeneration > Automation measuring and control systems , other, Plant SCADA, Power Plant Controllers (PPC), Substation Automation (SAS), Central Monitoring Systems, IoT-SCADA, EMS-BESS, PMKUSUM-RMS, and advanced LT/HT/ACDB Panels"
ADARSHA SPECIALTY CHEMICALS PVT LTD,http://adarsha.co/,assets/images/exhibitor-directory/dummy.png,"Established in 2010, it’s taken Adarsha Specialty Chemicals just a decade to claim the coveted spot of India’s prime supplier of silicone sealants and adhesives.
Adarsha Specialty Chemicals presents an ever-rapidly-expanding formidable inventory of products, its quality bolstered by its Six-Sigma protocols.
We offer solutions that are reliable, efficient, safe and sustainable.

We are committed to being eco-friendly, working hard to develop greener products and technologies that will help make the world we live in safer everyday.",India,adarsha.co/,Solar Energy > Suppliers of raw materials
Addwatt Power Solutions Limited,http://www.addwatt.com,assets/images/exhibitor-directory/1759923665_logoyoursolarepcpartner1759923734_1759923665_logoyoursolarepcpartner.png,"Addwatt Power Solutions Ltd. is a progressive Solar EPC company delivering end-to-end solutions for the design and construction of solar power plants. With a proven track record of 1.5 GW+ installations across 21+ states in India and an International project in Mauritius, Addwatt ensures seamless execution from concept to commissioning. Our esteemed clientele includes Torrent Power, Adani, Aditya Birla, IOCL, ONGC, BHEL, Indian Railways, and Smart Cities. Backed by advanced technology, modern construction techniques, and a skilled technical team, we provide turnkey solar solutions that maximize efficiency, reliability, and returns on investment",India,www.addwatt.com,"Solar Energy > Photovoltaic (PV) modules, hybrid systems, materials and equipments , Solar Energy > Turnkey solution providers , Solar Energy > Solar farm developers and owners , ENERGY EFFICIENCY > Energy efficient equipments for power generation, transmission and distribution , Cogeneration > Complete plant solution providers , Cogeneration > Utility planners and organizations"
ADICOMP INDIA PVT. LTD.,http://www.adicomp.com,assets/images/exhibitor-directory/1759250552_logo1759250573_1759250552_logo.jpg,"Adicomp is an Italian company with operations in the United States, Brazil, and India, specializing in gas compression and treatment. With over 25 years of experience and more than 10,000 skids in operation worldwide, Adicomp designs and manufactures compressor packages for biogas, biomethane, natural gas, and other applications. Its success is built on highly skilled designers, innovative solutions, cutting-edge technologies, and a production process capable of meeting diverse market needs. Adicomp is part of Ingersoll Rand, a partnership founded on shared values and a strategic vision focused on innovation and development in the energy sector.",India,www.adicomp.com,"Cogeneration > Equipment suppliers and service providers, Cogeneration > Consultants , other, Bio Gas and Carbon Capture"
ADM SOLAR POWER & INFRASTRUCTURE PVT LTD,http://www.orientsolar.com/,assets/images/exhibitor-directory/dummy.png,"Orient solar is owned and managed by top industry professionals with immense experience in mechanical and electrical engineering, bringing over 70 years of experience in the same. Orient was founded on the principles of bringing the power of renewable energy to the average population at an affordable price through a strong belief in local manufacturing and expertise. With this goal in mind, Orient boasts one of the largest fully automated panel manufacturing capacities and is one of the leading panel suppliers in the country. This includes M-10, M-6 and the most cutting-edge panels available in the market today.",India,www.orientsolar.com/,"Solar Energy > Manufacturers of cell and module encapsulation, crystal growth equipments, diffusion furnaces, laminators, mounting systems, concentrators, trackers and collectors , Solar Energy > Wire saws and consumables , Solar Energy > Silicon feedstock, ingot and wafer manufacturing , Solar Energy > Inverters, charge controllers, batteries and module connectors , Solar Energy > Photovoltaic (PV) modules, hybrid systems, materials and equipments , Solar Energy > Solar cells manufacturers , Solar Energy > Suppliers of raw materials , Solar Energy > Annual maintenance contractors , Solar Energy > Emission monitoring systems , Solar Energy > Solar street and billboard lighting systems"
ADYANI PLAST LIMITED,http://www.adyanigroup.com,assets/images/exhibitor-directory/dummy.png,"Adyani is a trusted one-stop BOS (Balance of System) solution provider, offering complete support for solar projects of any scale-from residential rooftops to large-scale utility installations. With a strong focus on quality and reliability, Adyani specializes in the manufacturing of ACDB & DCDB, which are essential for ensuring safety, efficiency, and seamless power management in solar systems. The company also produces a wide range of durable mounting structures using GP, Galvalume, and HDGI materials, tailored to withstand varied environmental conditions while maintaining structural integrity. Adyani delivers end-to-end BOS solutions that streamline installation support the long-term success of solar energy projects.",India,www.adyanigroup.com,"Solar Energy > Suppliers of raw materials , Solar Energy > System integrators, assemblers and distributors , Solar Energy > Turnkey solution providers"
Aegeus Technologies Limited,http://aegeustechnologies.com,assets/images/exhibitor-directory/1759814580_logoaegeus1759815110_1759814580_logoaegeus.jpg,"Aegeus Technologies is a leading innovator in robotic solar panel cleaning and O&M automation. Our waterless, AI-enabled solutions maximize plant efficiency, reduce operational costs, and conserve water, making solar energy more sustainable and profitable. From large-scale utility plants to rooftop systems, our advanced robotics, predictive analytics, and IoT-driven platforms deliver reliable, scalable, and environmentally responsible performance. With growing global presence and a commitment to innovation, Aegeus empowers solar asset owners to achieve higher yields and longer asset lifecycles. Discover how our intelligent automation is redefining the future of solar operations and maintenance.",India,aegeustechnologies.com,Solar Energy > Turnkey solution providers
Aeron Composite Limited,http://www.aeroncomposite.com,assets/images/exhibitor-directory/dummy.png,"Aeron Composite is largest manufacturer of FRP Products, specializing in FRP Gratings, FRP Cable Trays, FRP Handrails, FRP Staircase, FRP Odor Control Covers / Tank Covers, FRP Baffles and Partition walls, FRP Weirs, FRP Launder Cover, FRP Troughs, FRP Media Support for aeration tanks, FRP Ladders, FRP Canopy, tailored for the water, sewage & waste treatment & desalination industry. Aeron FRP Products are corrosion resistant, chemical resistant, strong yet lightweight, UV resistant, non-conductive, weather resistant.",India,www.aeroncomposite.com,"Solar Energy > Suppliers of raw materials , Solar Energy > Glass, substrates, coatings, resins, encapsulation materials, films, gasses , Wind Energy > Electrical and electronics items manufacturers , Cogeneration > Equipment suppliers and service providers, other, Solar rooftop & ground mount components manufacturer and supplier"
Aeron Systems Pvt Ltd.,http://www.aeronsystems.com,assets/images/exhibitor-directory/dummy.png,"Aeron Systems, established in 2008, is a dynamic deep-tech innovator dedicated to developing cutting-edge solutions that address evolving challenges faced by global clients. Our dual business sectors—Inertial Navigation Systems (INS) and Internet of Things (IoT)—allow us to cater to various industries such as aerospace, automotive, defense, environment, and renewable energy.We have supplied WMS to more than 40GW+ solar power plants. Attached is the project reference list & our company profile for your better understanding of the offerings. We are also working in the Middle East and SEA Region with Companies like Larsen & Toubro,Elsewedy,Alfanar,Engie,Ar-rass and many more .",India,www.aeronsystems.com,"Solar Energy > Emission monitoring systems , Solar Energy > Electrical test and measuring systems , Wind Energy > Electrical and electronics items manufacturers , Wind Energy > Wind monitoring and analysis systems suppliers , Cogeneration > Equipment suppliers and service providers, other, Weather Monitoring systems for Solar power plant"
AGRO HARDWARE INDUSTRIES PRIVATE LIMITED,http://agrohardware.com,assets/images/exhibitor-directory/dummy.png,"Founded in 1986, Agro Hardware has earned recognition as a trusted name in plastic manufacturing. While it began with an agricultural focus, the company has steadily diversified, serving leading clients such as Pidilite Industries, Frontier Polymers, and Golden Chemicals. Today, Agro Hardware is entering the renewable energy space with its groundbreaking solar walkway, a first-of-its-kind innovation in India. Designed to combine sustainability with practicality, this unique solution reflects the company’s forward-thinking approach. With a legacy of quality and adaptability, Agro Hardware continues to shape industries and set benchmarks for innovation.",India,agrohardware.com,"Solar Energy > Solar farm developers and owners , other, Solar Walkway Manufacturer"
AGROTEL CENO TEC GmbH (Ecosanitaz Green Solutions Pvt. Ltd),http://WWW.AGROTEL.EU,assets/images/exhibitor-directory/1759217268_agrotel-ceno-tec-transparent1759221530_1759217268_agrotel-ceno-tec-transparent.png,AGROTEL's PROGILE ATTACHED SEPARATELY,Germany,WWW.AGROTEL.EU,"Cogeneration > Consultants , other, Double Membrane Bio-Gas Storage Systems"
Airtouch Solar India PVT LTD,http://airtouchsolar.com/,assets/images/exhibitor-directory/1760004322_airtouchlogo1760004367_1760004322_airtouchlogo.png,"Airtouch Solar is a Tel Aviv Stock Exchange (TASE ARTS) listed leading waterless robotic cleaning solution company founded in 2017. Airtouch has state of the art manufacturing facilities in India and Israel with a production capacity of around 10 GW per year and more than 2 GW installed in Israel, India, Middle East and Americas. With patented wind blowing technology and best in class solar panel safety test result from PI Berlin, the robots are well suited for India. Airtouch solar provides solutions for fixed tilt and tracker-based systems using autonomous and semi-autonomous robots.",India,airtouchsolar.com/,"Solar Energy > Photovoltaic (PV) modules, hybrid systems, materials and equipments"
AJAY INDUSTRIAL CORPORATION LIMITED,http://WWW.AJAYINDUSTRIAL.COM,assets/images/exhibitor-directory/dummy.png,"Ajay Industrial Corporation Limited, established in 1961, is an Indian manufacturer specializing in Cable Management Systems, Solar Structures, and Water Management Solutions. Renowned for quality and innovation, AICL has received multiple National Export Excellence Awards from the Ministry of Commerce. We have our offices in Kenya, Uganda, Zambia, South Sudan, Cameroon, Nigeria, DR Congo, Tanzania and Dubai. Our product range includes Cable Trays, Raceway Systems, Junction Boxes, Solar Mounting Structures, GI Strip and Copper Strip, Earth Electrodes, and custom fabrications. We proudly supply to top companies like TATA, ABB, L&T, and government bodies such as NTPC, NHPC, and NDRF.",India,WWW.AJAYINDUSTRIAL.COM,"Solar Energy > Inverters, charge controllers, batteries and module connectors , Solar Energy > Photovoltaic (PV) modules, hybrid systems, materials and equipments , Solar Energy > Solar water heating/cooling systems and solar pumps Testing, monitoring systems, project consultants, suppliers of building integrated photovoltaic (BIPV) and solar thermal engineering, Solar Energy > Turnkey solution providers , Solar Energy > Solar farm developers and owners , Solar Energy > Solar street and billboard lighting systems"
Alfa Laval,http://www.alfalaval.in,assets/images/exhibitor-directory/1761219247_allogo1761219258_1761219247_allogo.png,"Alfa Laval is a global leader in heat transfer, separation, and fluid handling solutions, operating in 100+ countries with 140 years of innovation. It serves various key sectors like Biofuels, Energy, Pharma, Food, Marine, and Wastewater. It is listed on the Stockholm Stock Exchange with reported sales of SEK 66.9 billion (6 BEUR) in 2024. In India, Alfa Laval has been active since 1937 and is headquartered in Pune. Alfa Laval’s advanced separation and heat transfer technologies support every stage of the biogas production from pre-treatment to post-treatment.
Together, we Pioneer a Positive Impact.",India,www.alfalaval.in,"other, Separation Technology"
ALISHAN GREEN PVT. LTD.,http://www.alishangreenenergy.com/,assets/images/exhibitor-directory/dummy.png,"Alishan Green Energy, part of the Alishan Group, is India’s largest independent manufacturer of Encapsulants and Backsheets. With 4.2 GW encapsulant capacity, soon expanding to 6.6 GW, and 3 GW Backsheet capacity including white, black and transparent Backsheets. Backed by NABL accredited lab, all Alishan products are IEC and UL certified. With innovations like Low Acid EVA, EPE NT and EPE DC this year, We support today’s latest solar cell technologies.",India,www.alishangreenenergy.com/,"Solar Energy > Suppliers of raw materials , Solar Energy > Glass, substrates, coatings, resins, encapsulation materials, films, gasses"
Alpex Solar Limited,http://www.alpexsolar.com,assets/images/exhibitor-directory/1758977373_logo1758977649_1758977373_logo.png,"Alpex Solar, headquartered in Greater Noida, is a fast-growing solar manufacturer spearheading India’s clean energy transition. The company is rapidly expanding with five new facilities under development across Greater Noida, Kosi-Kotwan (UP), and Madhya Pradesh. Its Kosi-Kotwan facility is progressing at pace, with Phase 1 of a 1.6 GW solar cell project (500 MW by FY26) and a 12,000-ton aluminum frame plant nearing commissioning. By FY27, Alpex aims to triple its module capacity from 1.2 GW to 3.6 GW, reinforcing its position as a trusted partner in meeting India’s surging solar demand. Its subsidiary, Alpex Green Energies Private Limited (AGEPL),",India,www.alpexsolar.com,"Solar Energy > Manufacturers of cell and module encapsulation, crystal growth equipments, diffusion furnaces, laminators, mounting systems, concentrators, trackers and collectors , Solar Energy > Photovoltaic (PV) modules, hybrid systems, materials and equipments , Solar Energy > Solar cells manufacturers , Solar Energy > System integrators, assemblers and distributors , Solar Energy > Turnkey solution providers , Solar Energy > Annual maintenance contractors , Cogeneration > Complete plant solution providers , Cogeneration > Project developers"
Alsmiths Renewables Pvt. Ltd.,http://www.alsmiths.com,assets/images/exhibitor-directory/1760424401_10000391291760684236_1760424401_1000039129.jpg,"Manufacturer of quality aluminium frames for Solar PV modules and aluminium extruded profiles for solar module mounting structures.
Having in-house infrastructure facilities for manufacturing of 1500 MT of aluminium extrusions , sand blasting,  anodizing, most modern automatic aluminium frames fabrication machines and team of technical  experts, Alsmiths Renewables are capable of catering the customized requirement of the potential buyers of aluminium frames and aluminium extruded profiles for mounting structures.
For enquiry please get in touch with Mr. Manab Mazumder, Vice- President (Marketing) by email at[email protected]or whatsApp at +91 8981005611.",India,www.alsmiths.com,"Solar Energy > Manufacturers of cell and module encapsulation, crystal growth equipments, diffusion furnaces, laminators, mounting systems, concentrators, trackers and collectors , Solar Energy > Photovoltaic (PV) modules, hybrid systems, materials and equipments , Solar Energy > Solar water heating/cooling systems and solar pumps Testing, monitoring systems, project consultants, suppliers of building integrated photovoltaic (BIPV) and solar thermal engineering, Solar Energy > Turnkey solution providers , Solar Energy > Solar farm developers and owners , Solar Energy > Electrical test and measuring systems , Solar Energy > Solar street and billboard lighting systems, ENERGY EFFICIENCY > Energy efficient equipments for power generation, transmission and distribution , ENERGY EFFICIENCY > Industrial and decorative lighting equipment, luminaries, fixtures and accessories, ENERGY EFFICIENCY > Manufacturers of motors and pumps , ENERGY EFFICIENCY > Manufacturers of LED and charge controllers"
